{
  "$schema": "https://json-schema.org/draft/2020-12/schema",
  "$id": "https://raw.githubusercontent.com/clayharmon/paroikia/main/schema/evidence-item.schema.json",
  "title": "Evidence item",
  "description": "A single piece of evidence for Christian presence: an inscription, papyrus, literary passage, council subscription, or archaeological feature. One file per item under data/evidence/, named <id>.json.",
  "type": "object",
  "required": ["id", "label", "evidence_type", "place", "date", "source"],
  "additionalProperties": false,
  "properties": {
    "id": {
      "type": "string",
      "pattern": "^[a-z0-9][a-z0-9-]{2,63}$",
      "description": "Stable slug. Must equal the filename without .json; checked by validate.ts."
    },
    "label": {
      "type": "string",
      "minLength": 3,
      "maxLength": 200,
      "description": "One-line identification, e.g. 'Ignatius of Antioch addresses the church at Ephesus'."
    },
    "evidence_type": {
      "type": "string",
      "$comment": "Allowed values and their quality grades live in schema/vocab/evidence-type.json; membership is checked by validate.ts, not by enum, so the vocabulary stays the single source of truth."
    },
    "place": { "$ref": "#/$defs/place" },
    "date": { "$ref": "#/$defs/dateRange" },
    "source": { "$ref": "#/$defs/source" },
    "external_ids": { "$ref": "#/$defs/externalIds" },
    "notes": { "type": "string" }
  },
  "$defs": {
    "place": {
      "type": "object",
      "additionalProperties": false,
      "required": ["certainty"],
      "properties": {
        "pleiades_uri": {
          "type": "string",
          "pattern": "^https://pleiades\\.stoa\\.org/places/[0-9]+$",
          "description": "The Pleiades place URI. This project maintains no coordinates; they are joined from the Pleiades dump at build time."
        },
        "certainty": {
          "type": "string",
          "$comment": "Values in schema/vocab/place-certainty.json."
        },
        "ancient_name": { "type": "string" },
        "note": {
          "type": "string",
          "description": "For region_only and unlocated places: what is actually known about the location. validate.ts requires it for those two certainty values."
        }
      },
      "if": {
        "properties": { "certainty": { "const": "unlocated" } },
        "required": ["certainty"]
      },
      "then": {},
      "else": { "required": ["pleiades_uri"] }
    },
    "dateRange": {
      "type": "object",
      "additionalProperties": false,
      "required": ["not_before", "not_after", "basis"],
      "properties": {
        "not_before": { "$ref": "#/$defs/year" },
        "not_after": { "$ref": "#/$defs/year" },
        "basis": {
          "type": "string",
          "$comment": "Values in schema/vocab/dating-basis.json."
        },
        "note": { "type": "string" }
      },
      "$comment": "There is deliberately no single 'date' field. A point date is expressed as not_before == not_after."
    },
    "year": {
      "type": "integer",
      "minimum": -500,
      "maximum": 1000,
      "$comment": "ISO 8601 / astronomical year numbering: 1 BCE is 0, 2 BCE is -1. Bounds are a sanity check, not the project scope."
    },
    "source": {
      "type": "object",
      "additionalProperties": false,
      "required": ["primary"],
      "properties": {
        "primary": {
          "type": "array",
          "minItems": 1,
          "items": { "$ref": "#/$defs/citation" },
          "description": "The primary source(s): the edition or corpus entry for documents, the passage for literary texts."
        },
        "secondary": {
          "type": "array",
          "items": { "$ref": "#/$defs/citation" },
          "description": "Modern scholarship supporting the dating or interpretation."
        }
      }
    },
    "citation": {
      "type": "object",
      "additionalProperties": false,
      "required": ["cite"],
      "properties": {
        "cite": {
          "type": "string",
          "minLength": 3,
          "description": "Human-readable citation with locus, e.g. 'Ignatius, Eph. 1.3' or 'SEG 30.1479'."
        },
        "bibkey": {
          "type": "string",
          "description": "Key into data/sources/bibliography.bib; existence is checked by validate.ts."
        },
        "url": { "type": "string", "pattern": "^https?://" }
      }
    },
    "externalIds": {
      "type": "object",
      "additionalProperties": false,
      "properties": {
        "trismegistos": { "type": "string", "pattern": "^[0-9]+$" },
        "edh": { "type": "string", "pattern": "^HD[0-9]{6}$" },
        "papyri_info": { "type": "string", "minLength": 1 },
        "cts_urn": { "type": "string", "pattern": "^urn:cts:" }
      }
    }
  }
}
