{
  "id": "lit-apocalypse-pergamum",
  "label": "The Apocalypse of John addresses the church at Pergamum",
  "evidence_type": "literary_contemporary",
  "place": {
    "pleiades_uri": "https://pleiades.stoa.org/places/550812",
    "certainty": "certain",
    "ancient_name": "Pergamum"
  },
  "date": {
    "not_before": 68,
    "not_after": 96,
    "basis": "scholarly",
    "note": "Composition of the Apocalypse: the dominant Domitianic dating (c. 95, per Irenaeus, Haer. 5.30.3) as upper bound, the minority Neronian dating as lower."
  },
  "source": {
    "primary": [{ "cite": "Apocalypse of John (Revelation) 2.12–17" }],
    "secondary": [
      { "cite": "Harnack, Mission and Expansion, vol. 2, pp. 185–186", "bibkey": "harnack1908" }
    ]
  },
  "notes": "One of the seven churches of Apoc. 2–3, including the martyrdom of Antipas (2.13)."
}
