{
  "id": "lit-ignatius-philadelphia",
  "label": "Ignatius of Antioch addresses the church at Philadelphia",
  "evidence_type": "literary_contemporary",
  "place": {
    "pleiades_uri": "https://pleiades.stoa.org/places/550822",
    "certainty": "certain",
    "ancient_name": "Philadelpheia"
  },
  "date": {
    "not_before": 105,
    "not_after": 117,
    "basis": "scholarly",
    "note": "Ignatius wrote en route to martyrdom at Rome. Eusebius (Hist. eccl. 3.36) places the journey under Trajan (reigned 98–117), traditionally c. 107–110; the range brackets the later part of Trajan's reign. A minority redates the letters to c. 125–150 (Barnes 2008)."
  },
  "source": {
    "primary": [{ "cite": "Ignatius, To the Philadelphians, salutation" }],
    "secondary": [
      { "cite": "Harnack, Mission and Expansion, vol. 2, pp. 185–186", "bibkey": "harnack1908" }
    ]
  },
  "notes": "Philadelpheia in Lydia (Pleiades 550822), not the Ammonite Philadelphia (Amman) or Egyptian Philadelphia. Independent of and ~15 years later than the Apocalypse's letter to Philadelphia (lit-apocalypse-philadelphia); both attesting the same church is intended."
}
