{
  "id": "lit-1peter-galatia",
  "label": "1 Peter is addressed to Christians in the province of Galatia",
  "evidence_type": "literary_contemporary",
  "place": {
    "pleiades_uri": "https://pleiades.stoa.org/places/619161",
    "certainty": "region_only",
    "ancient_name": "Galatia",
    "note": "The address names the Roman province of Galatia. Pinned to the Galatia province/region resource (619161). Distinct from the south-Galatian cities already attested from Acts in batch 2 (Pisidian Antioch, Iconium, Lystra, Derbe); those are settlements, this is the province as a whole."
  },
  "date": {
    "not_before": 60,
    "not_after": 96,
    "basis": "scholarly",
    "note": "Composition of 1 Peter. Traditional Petrine authorship puts it before Peter's death under Nero (c. 64); the majority view holds it pseudonymous, c. 70–90. Harnack (p. 186 n.) assigns it to 'the earlier years of Domitian' (c. 81–85). Upper bound 96 (end of Domitian); a minority dates it into the early second century."
  },
  "source": {
    "primary": [
      {
        "cite": "1 Peter 1.1",
        "url": "https://biblehub.com/1_peter/1-1.htm"
      }
    ],
    "secondary": [
      {
        "cite": "Harnack, Mission and Expansion, vol. 2, pp. 92–93 (register of communities traceable before Trajan)",
        "bibkey": "harnack1908"
      }
    ]
  },
  "notes": "Harnack's register lists 'unnamed localities in Galatia (Gal. and 1 Pet. i. 1),' pairing the address of 1 Peter with Paul's Galatians as evidence for Christians across the province."
}
